{
  "id": "service-based-arch",
  "title": "Service-Based Architecture",
  "ring": "adopt",
  "quadrant": "architecture-methods-and-patterns",
  "relatedTo": [],
  "alternativeTo": [],
  "skillsNeeded": [],
  "supportsTvdBB": [],
  "owners": [],
  "status": "draft",
  "featured": true,
  "__content": "\n\nJava"
}
