{
  "id": "platys",
  "title": "Platys",
  "ring": "trial",
  "quadrant": "languages-and-frameworks",
  "relatedTo": [],
  "alternativeTo": [],
  "skillsNeeded": [],
  "supportsTvdBB": [],
  "owners": [],
  "status": "draft",
  "featured": true,
  "__content": "\n\n[platys](github.com/platys) is a tool developed by Trivadis for generating and provisioning Modern Data Platforms based on Docker and Docker Compose.\n"
}
