{
  "id": "tableau",
  "title": "Tableau",
  "ring": "adopt",
  "quadrant": "platforms-and-services",
  "relatedTo": [],
  "alternativeTo": [
    "power-bi",
    "superset",
    "redas"
  ],
  "skillsNeeded": [],
  "supportsTvdBB": [],
  "owners": [],
  "status": "draft",
  "featured": true,
  "__content": "\n\n[Tableau](https://www.tableau.com/) query relational databases, online analytical processing cubes, cloud databases, and spreadsheets to generate graph-type data visualizations. The products can also extract, store, and retrieve data from an in-memory data engine."
}
