{
  "id": "sqlserver",
  "title": "Microsoft SQL Server",
  "ring": "adopt",
  "quadrant": "data-management",
  "relatedTo": [],
  "alternativeTo": [],
  "skillsNeeded": [],
  "supportsTvdBB": [],
  "owners": [],
  "status": "draft",
  "featured": true,
  "__content": "\n\nOracle Database is a very popular relational database management system.\n"
}
