{
  "id": "great-expectations",
  "title": "Great Expectations",
  "ring": "watch",
  "quadrant": "languages-and-frameworks",
  "relatedTo": [],
  "alternativeTo": [],
  "skillsNeeded": [],
  "supportsTvdBB": [],
  "owners": [],
  "status": "draft",
  "featured": true,
  "__content": "\n\n[Great Expectations](https://greatexpectations.io/) helps data teams eliminate pipeline debt, through data testing, documentation, and profiling.\n"
}
