{
  "id": "influxdb",
  "title": "InfluxDB",
  "ring": "assess",
  "quadrant": "data-management",
  "relatedTo": [],
  "alternativeTo": [],
  "skillsNeeded": [],
  "supportsTvdBB": [],
  "owners": [],
  "status": "draft",
  "featured": true,
  "__content": "\n\n[InfluxDB](https://www.influxdata.com/products/influxdb-overview/) is a native time series database designed to handle high write and query loads."
}
