{
  "id": "atlas",
  "title": "Apache Atlas",
  "ring": "assess",
  "quadrant": "platforms-and-services",
  "relatedTo": [],
  "alternativeTo": [],
  "skillsNeeded": [],
  "supportsTvdBB": [],
  "owners": [],
  "status": "draft",
  "featured": true,
  "__content": "\n\n[Apache Atlas](https://atlas.apache.org/#/) is a Data Catalog.Atlas is a scalable and extensible set of core foundational governance services â€“ enabling enterprises to effectively and efficiently meet their compliance requirements within Hadoop and allows integration with the whole enterprise data ecosystem.\n"
}
