{
  "id": "pulsar",
  "title": "Apache Pulsar",
  "ring": "watch",
  "quadrant": "platforms-and-services",
  "relatedTo": [],
  "alternativeTo": [],
  "skillsNeeded": [],
  "supportsTvdBB": [],
  "owners": [],
  "status": "draft",
  "featured": true,
  "__content": "\n\n[Apache Pulsar](https://pulsar.apache.org/) is an open-source distributed pub-sub messaging system originally created at Yahoo and now part of the Apache Software Foundation.\n\nIt has some features which are not (yet) available in Apache Kafka and therefore it is worth to have a look at Apache Pulsar."
}
