{
  "id": "kubernetes",
  "title": "Kubernetes",
  "ring": "adopt",
  "quadrant": "platforms-and-services",
  "relatedTo": [],
  "alternativeTo": [],
  "skillsNeeded": [],
  "supportsTvdBB": [],
  "owners": [],
  "status": "draft",
  "featured": true,
  "__content": "\n\nKubernetes is an open-source system for automating deployment, scaling and management of containerized applications that was originally designed by Google and now maintained by the Cloud Native Computing Foundation. It aims to provide a \"platform for automating deployment, scaling, and operations of application containers across clusters of hosts\". It works with a range of container tools, including Docker."
}
