{
  "id": "nextflow",
  "title": "Nextflow",
  "ring": "watch",
  "quadrant": "platforms-and-services",
  "relatedTo": [],
  "alternativeTo": [],
  "skillsNeeded": [],
  "supportsTvdBB": [],
  "owners": [],
  "status": "draft",
  "featured": true,
  "__content": "\n\n[Nextflow](https://www.nextflow.io/) enables scalable and reproducible scientific workflows using software containers. It allows the adaptation of pipelines written in the most common scripting languages. \n\nts fluent DSL simplifies the implementation and the deployment of complex parallel and reactive workflows on clouds and clusters. "
}
