{
  "id": "angular",
  "title": "Angular",
  "info": "a modern web framework",
  "ring": "adopt",
  "quadrant": "languages-and-frameworks",
  "relatedTo": [],
  "alternativeTo": [],
  "skillsNeeded": [],
  "supportsTvdBB": [],
  "owners": [],
  "status": "draft",
  "featured": true,
  "__content": "\n\n[Angular](https://angular.io/) s a TypeScript-based open-source web application framework led by the Angular Team at Google and by a community of individuals and corporations. Angular is a complete rewrite from the same team that built AngularJS. \n\n"
}
