{
  "id": "trino",
  "title": "Trino",
  "ring": "watch",
  "quadrant": "platforms-and-services",
  "relatedTo": [],
  "alternativeTo": [],
  "skillsNeeded": [],
  "supportsTvdBB": [],
  "owners": [],
  "status": "draft",
  "featured": true,
  "__content": "\n\n[Trino](https://trino.io/) is a distributed SQL query engine designed to query large data sets distributed over one or more heterogeneous data sources.\n\nTrino was previously named PrestoSQL but due to a competing fork of Presto called PrestoDB, the project has been renamed to Trino in December 2020."
}
