{
  "id": "oracle-directory-service",
  "title": "Oracle Directory Services",
  "ring": "adopt",
  "quadrant": "platforms-and-services",
  "relatedTo": [],
  "alternativeTo": [],
  "skillsNeeded": [],
  "supportsTvdBB": [],
  "owners": [],
  "status": "draft",
  "featured": true,
  "__content": "\n\nOracle Internet Directory and Oracle Unified Directory..."
}
