{
  "id": "airflow",
  "title": "Apache Airflow",
  "ring": "trial",
  "quadrant": "platforms-and-services",
  "relatedTo": [],
  "alternativeTo": [],
  "skillsNeeded": [],
  "supportsTvdBB": [],
  "owners": [],
  "status": "draft",
  "featured": true,
  "__content": "\n\n[Apache Airflow](https://airflow.apache.org/) is a platform created by the community to programmatically author, schedule and monitor workflows."
}
