{
  "id": "h2o-wave",
  "title": "H2O Wave",
  "ring": "watch",
  "quadrant": "languages-and-frameworks",
  "relatedTo": [],
  "alternativeTo": [],
  "skillsNeeded": [],
  "supportsTvdBB": [],
  "owners": [],
  "status": "draft",
  "featured": true,
  "__content": "\n\n[H2O Wave](https://h2oai.github.io/wave/) is a software stack for building beautiful, low-latency, realtime, browser-based applications and dashboards entirely in Python without using HTML, Javascript, or CSS."
}
