{
  "id": "dvc",
  "title": "DVC",
  "ring": "watch",
  "quadrant": "languages-and-frameworks",
  "relatedTo": [],
  "alternativeTo": [],
  "skillsNeeded": [],
  "supportsTvdBB": [],
  "owners": [],
  "status": "draft",
  "featured": true,
  "__content": "\n\n[DVC](https://dvc.org/) is built to make ML models shareable and reproducible. It is designed to handle large files, data sets, machine learning models, and metrics as well as code."
}
